Keyword,Search Intent,Primary Landing Page,Country,Priority
cordless box cutter,Transactional,/products,United States,High
safe box opener,Transactional,/products,United States,High
warehouse box cutter,Transactional,/products,United States,High
electric box cutter,Transactional,/products,United States,High
best box cutter for warehouse,Commercial,/products,United States,High
box cutter safety guide,Informational,/safety-guide,United States,High
how to open boxes safely,Informational,/safety-guide,United States,High
how to reduce box cutter injuries,Informational,/safety-guide,United States,High
warehouse cutting safety checklist,Informational,/safety-guide,United States,Medium
retail stockroom box opener,Commercial,/industries,United States,Medium
fulfillment center box opener,Commercial,/industries,United States,Medium
best box cutter for ecommerce shipping,Commercial,/industries,United States,Medium
cordless box cutter canada,Transactional,/products,Canada,Medium
safe box opener canada,Transactional,/products,Canada,Medium
warehouse box cutter uk,Transactional,/products,United Kingdom,Medium
electric box cutter australia,Transactional,/products,Australia,Medium
boxblayde cordless box cutter,Branded,/products,United States,High
boxblayde contact,Branded,/contact,United States,Medium
